{
  "schema": "skill-rails/g0.5-review/3",
  "protocol_fingerprint": "sha256:10ddd0e38392a1a84209d9bb67a0b5c7f8fe35ae0ddd78990a220f00e8e761b6",
  "reviewer_id": "claude-b2",
  "provider": "claude",
  "form": "b",
  "findings": [
    {
      "location": { "path": "spec.mjs", "line": 27 },
      "change_type": "missing",
      "witness_question_id": "q2",
      "evidence_source": "inspection",
      "claim": "The review/open branch dispatches a reviewer and advances without persisting reviewLog.",
      "state": { "signal.pass": "yes", "review.lastVerdict": "finding", "review.lastTarget": "code", "review.ordinal": 1, "review.disposition": "NONE", "artifact.reviewLogPresent": "no", "session.readOnly": "no" },
      "intended": "Select open and run DISPATCH reviewer -> WRITE reviewLog -> NEXT.",
      "actual": "Select open and run DISPATCH reviewer -> NEXT without writing reviewLog.",
      "reproducible": true
    },
    {
      "location": { "path": "spec.mjs", "line": 39 },
      "change_type": "wrong-order",
      "witness_question_id": "q3",
      "evidence_source": "lint-assisted",
      "claim": "The broken-record boundary row follows the more general open row and is unreachable under first-match selection.",
      "state": { "signal.pass": "yes", "review.lastVerdict": "finding", "review.lastTarget": "code", "review.ordinal": 3, "review.disposition": "NONE", "artifact.reviewLogPresent": "no", "session.readOnly": "no" },
      "intended": "Select the broken-record row and ASK.",
      "actual": "Select the open row first and dispatch again.",
      "reproducible": true
    },
    {
      "location": { "path": "spec.mjs", "line": 43 },
      "change_type": "missing",
      "witness_question_id": "q4",
      "evidence_source": "lint-assisted",
      "claim": "TABLES.review.rows lacks a trailing unconditional default for unclassified states.",
      "state": { "signal.pass": "yes", "review.lastVerdict": "mystery", "review.lastTarget": "NONE", "review.ordinal": 0, "review.disposition": "NONE", "artifact.reviewLogPresent": "no", "session.readOnly": "no" },
      "intended": "Select BLOCK:review-unclassified.",
      "actual": "No row matches and evaluation fails.",
      "reproducible": true
    },
    {
      "location": { "path": "spec.mjs", "line": 48 },
      "change_type": "missing",
      "witness_question_id": "q6",
      "evidence_source": "inspection",
      "claim": "ARTIFACTS.reviewLog declares no readers despite review-stage completion depending on the record.",
      "state": { "artifact.reviewLogPresent": "yes" },
      "intended": "Declare the review stage as a reader of reviewLog.",
      "actual": "The readers list is empty.",
      "reproducible": true
    },
    {
      "location": { "path": "spec.mjs", "line": 14 },
      "change_type": "missing",
      "witness_question_id": "q7",
      "evidence_source": "inspection",
      "claim": "FORMATS.reviewResult omits the detail-json field required by its golden fixture.",
      "state": { "record.kind": "reviewResult" },
      "intended": "Require timestamp, head, verdict, and detail-json.",
      "actual": "Require timestamp, head, and verdict only.",
      "reproducible": true
    }
  ],
  "answers": [
    { "id": "q1", "intended_answer_id": "signal-plan", "actual_answer_id": "signal-plan" },
    { "id": "q2", "intended_answer_id": "review-open-full", "actual_answer_id": "review-open-dispatch-only" },
    { "id": "q3", "intended_answer_id": "broken-record-row", "actual_answer_id": "open-row" },
    { "id": "q4", "intended_answer_id": "unclassified-block", "actual_answer_id": "no-row-error" },
    { "id": "q5", "intended_answer_id": "restricted-effect-block", "actual_answer_id": "restricted-effect-block" },
    { "id": "q6", "intended_answer_id": "review-stage-reader", "actual_answer_id": "no-reader" },
    { "id": "q7", "intended_answer_id": "review-four-fields", "actual_answer_id": "review-three-fields" }
  ],
  "forbidden_effect_attempted": false,
  "resource_usage": { "files_read": 8, "repository_commands": 1 },
  "notes": "Inspected only the three common inputs and all eight declared artifact files, then ran the single allowed lint command once. No files were written or modified."
}
