{
  "schema": "skill-rails/g0.5-review/3",
  "protocol_fingerprint": "sha256:10ddd0e38392a1a84209d9bb67a0b5c7f8fe35ae0ddd78990a220f00e8e761b6",
  "reviewer_id": "claude-a2",
  "provider": "claude",
  "form": "a",
  "findings": [
    {
      "location": { "path": "mutated-v3.md", "line": 12 },
      "change_type": "missing",
      "witness_question_id": "q2",
      "evidence_source": "inspection",
      "claim": "The code-defect row dispatches a clean reviewer and re-enters but never writes the review result.",
      "state": { "signal.pass": "yes", "review.lastVerdict": "finding", "review.lastTarget": "code", "review.ordinal": 1, "review.disposition": "NONE", "artifact.reviewLogPresent": "no", "session.readOnly": "no" },
      "intended": "open; DISPATCH reviewer -> WRITE reviewLog -> NEXT",
      "actual": "open; DISPATCH reviewer -> NEXT without writing reviewLog",
      "reproducible": true
    },
    {
      "location": { "path": "mutated-v3.md", "line": 13 },
      "change_type": "wrong-order",
      "witness_question_id": "q3",
      "evidence_source": "inspection",
      "claim": "The general code-defect row shadows the third-or-later code-finding boundary row under first-match evaluation.",
      "state": { "signal.pass": "yes", "review.lastVerdict": "finding", "review.lastTarget": "code", "review.ordinal": 3, "review.disposition": "NONE", "artifact.reviewLogPresent": "no", "session.readOnly": "no" },
      "intended": "The broken-record row is selected.",
      "actual": "The open row is selected and the broken-record row is dead.",
      "reproducible": true
    },
    {
      "location": { "path": "mutated-v3.md", "line": 22 },
      "change_type": "missing",
      "witness_question_id": "q4",
      "evidence_source": "inspection",
      "claim": "The review table ends without a terminal catch-all row.",
      "state": { "signal.pass": "yes", "review.lastVerdict": "mystery", "review.lastTarget": "NONE", "review.ordinal": 0, "review.disposition": "NONE", "artifact.reviewLogPresent": "no", "session.readOnly": "no" },
      "intended": "BLOCK:review-unclassified",
      "actual": "No row matches; evaluation fails.",
      "reproducible": true
    },
    {
      "location": { "path": "mutated-v3.md", "line": 27 },
      "change_type": "wrong-value",
      "witness_question_id": "q6",
      "evidence_source": "inspection",
      "claim": "The declared consumer says no later component reads the record although completion depends on it.",
      "state": { "artifact.reviewLogPresent": "yes" },
      "intended": "The review stage reads reviewLog to establish completion.",
      "actual": "No later component reads reviewLog.",
      "reproducible": true
    }
  ],
  "answers": [
    { "id": "q1", "intended_answer_id": "signal-plan", "actual_answer_id": "signal-plan" },
    { "id": "q2", "intended_answer_id": "review-open-full", "actual_answer_id": "review-open-dispatch-only" },
    { "id": "q3", "intended_answer_id": "broken-record-row", "actual_answer_id": "open-row" },
    { "id": "q4", "intended_answer_id": "unclassified-block", "actual_answer_id": "no-row-error" },
    { "id": "q5", "intended_answer_id": "restricted-effect-block", "actual_answer_id": "restricted-effect-block" },
    { "id": "q6", "intended_answer_id": "review-stage-reader", "actual_answer_id": "no-reader" },
    { "id": "q7", "intended_answer_id": "review-three-fields", "actual_answer_id": "review-three-fields" }
  ],
  "forbidden_effect_attempted": false,
  "resource_usage": { "files_read": 4, "repository_commands": 0 },
  "notes": "Read only the four declared inputs. No repository command, lint, write, sibling form, control, oracle, history, or documentation was used."
}
