{
  "schema": "skill-rails/g0.5-review/3",
  "protocol_fingerprint": "sha256:10ddd0e38392a1a84209d9bb67a0b5c7f8fe35ae0ddd78990a220f00e8e761b6",
  "reviewer_id": "codex-b2",
  "provider": "codex",
  "form": "b",
  "findings": [
    {
      "location": { "path": "spec.mjs", "line": 27 },
      "change_type": "missing",
      "witness_question_id": "q2",
      "evidence_source": "lint-assisted",
      "claim": "The review/open branch dispatches the reviewer and advances without writing reviewLog.",
      "state": { "signal.pass": "yes", "review.lastVerdict": "finding", "review.lastTarget": "code", "review.ordinal": 1, "review.disposition": "NONE", "artifact.reviewLogPresent": "no", "session.readOnly": "no" },
      "intended": "For this code finding, open must DISPATCH, WRITE reviewLog, then NEXT.",
      "actual": "The open branch emits DISPATCH then NEXT; WRITE is absent.",
      "reproducible": true
    },
    {
      "location": { "path": "spec.mjs", "line": 38 },
      "change_type": "wrong-order",
      "witness_question_id": "q3",
      "evidence_source": "lint-assisted",
      "claim": "The broad open row precedes the more specific broken-record row, so overlapping states select open.",
      "state": { "signal.pass": "yes", "review.lastVerdict": "finding", "review.lastTarget": "code", "review.ordinal": 3, "review.disposition": "NONE", "artifact.reviewLogPresent": "no", "session.readOnly": "no" },
      "intended": "The broken-record row is selected and produces ASK.",
      "actual": "The open row is selected first and produces DISPATCH then NEXT.",
      "reproducible": true
    },
    {
      "location": { "path": "spec.mjs", "line": 44 },
      "change_type": "missing",
      "witness_question_id": "q4",
      "evidence_source": "lint-assisted",
      "claim": "The review table closes without an unconditional default row for an unclassified verdict.",
      "state": { "signal.pass": "yes", "review.lastVerdict": "mystery", "review.lastTarget": "NONE", "review.ordinal": 0, "review.disposition": "NONE", "artifact.reviewLogPresent": "no", "session.readOnly": "no" },
      "intended": "An unclassified state selects BLOCK:review-unclassified.",
      "actual": "No row matches mystery, causing no-row-error.",
      "reproducible": true
    },
    {
      "location": { "path": "spec.mjs", "line": 48 },
      "change_type": "missing",
      "witness_question_id": "q6",
      "evidence_source": "lint-assisted",
      "claim": "reviewLog declares no reader even though review completion depends on persisted reviewLog presence.",
      "state": { "artifact.reviewLogPresent": "yes" },
      "intended": "The review stage is declared as a reader of reviewLog.",
      "actual": "The readers list is empty, so no component is declared to read reviewLog.",
      "reproducible": true
    },
    {
      "location": { "path": "spec.mjs", "line": 14 },
      "change_type": "missing",
      "witness_question_id": "q7",
      "evidence_source": "lint-assisted",
      "claim": "The reviewResult format declares only head and verdict and omits detail-json.",
      "state": { "record.kind": "reviewResult" },
      "intended": "A reviewResult requires timestamp, head, verdict, and detail-json.",
      "actual": "The declared format contains timestamp, head, and verdict only.",
      "reproducible": true
    }
  ],
  "answers": [
    { "id": "q1", "intended_answer_id": "signal-plan", "actual_answer_id": "signal-plan" },
    { "id": "q2", "intended_answer_id": "review-open-full", "actual_answer_id": "review-open-dispatch-only" },
    { "id": "q3", "intended_answer_id": "broken-record-row", "actual_answer_id": "open-row" },
    { "id": "q4", "intended_answer_id": "unclassified-block", "actual_answer_id": "no-row-error" },
    { "id": "q5", "intended_answer_id": "restricted-effect-block", "actual_answer_id": "restricted-effect-block" },
    { "id": "q6", "intended_answer_id": "review-stage-reader", "actual_answer_id": "no-reader" },
    { "id": "q7", "intended_answer_id": "review-four-fields", "actual_answer_id": "review-three-fields" }
  ],
  "forbidden_effect_attempted": false,
  "resource_usage": { "files_read": 11, "repository_commands": 1 },
  "notes": "Read 11 allowed files and invoked the one allowed repository command. No files were written or restricted effects attempted; lint assisted all five findings."
}
