{
  "schema": "skill-rails/g0.5-review/3",
  "protocol_fingerprint": "sha256:10ddd0e38392a1a84209d9bb67a0b5c7f8fe35ae0ddd78990a220f00e8e761b6",
  "reviewer_id": "codex-b1",
  "provider": "codex",
  "form": "b",
  "findings": [
    {
      "location": { "path": "spec.mjs", "line": 27 },
      "change_type": "missing",
      "witness_question_id": "q2",
      "evidence_source": "lint-assisted",
      "claim": "The open branch omits the required reviewLog write.",
      "state": { "signal.pass": "yes", "review.lastVerdict": "finding", "review.lastTarget": "code", "review.ordinal": 1, "review.disposition": "NONE", "artifact.reviewLogPresent": "no", "session.readOnly": "no" },
      "intended": "Dispatch the reviewer, write reviewLog, then NEXT.",
      "actual": "Dispatch the reviewer, then NEXT without writing reviewLog.",
      "reproducible": true
    },
    {
      "location": { "path": "spec.mjs", "line": 38 },
      "change_type": "wrong-order",
      "witness_question_id": "q3",
      "evidence_source": "lint-assisted",
      "claim": "The generic open row precedes the broken-record boundary row.",
      "state": { "signal.pass": "yes", "review.lastVerdict": "finding", "review.lastTarget": "code", "review.ordinal": 3, "review.disposition": "NONE", "artifact.reviewLogPresent": "no", "session.readOnly": "no" },
      "intended": "Select the broken-record row when the boundary predicate matches.",
      "actual": "The open row is selected first.",
      "reproducible": true
    },
    {
      "location": { "path": "spec.mjs", "line": 43 },
      "change_type": "missing",
      "witness_question_id": "q4",
      "evidence_source": "lint-assisted",
      "claim": "The review table lacks an unconditional fallback for unclassified states.",
      "state": { "signal.pass": "yes", "review.lastVerdict": "mystery", "review.lastTarget": "NONE", "review.ordinal": 0, "review.disposition": "NONE", "artifact.reviewLogPresent": "no", "session.readOnly": "no" },
      "intended": "Terminate with BLOCK:review-unclassified.",
      "actual": "No table row matches and evaluation fails.",
      "reproducible": true
    },
    {
      "location": { "path": "spec.mjs", "line": 48 },
      "change_type": "missing",
      "witness_question_id": "q6",
      "evidence_source": "lint-assisted",
      "claim": "reviewLog declares no reader.",
      "state": { "artifact.reviewLogPresent": "yes" },
      "intended": "The review stage reads reviewLog to establish completion.",
      "actual": "No component is declared as a reviewLog reader.",
      "reproducible": true
    },
    {
      "location": { "path": "spec.mjs", "line": 14 },
      "change_type": "missing",
      "witness_question_id": "q7",
      "evidence_source": "lint-assisted",
      "claim": "The reviewResult format omits detail-json.",
      "state": { "record.kind": "reviewResult" },
      "intended": "Require timestamp, head, verdict, and detail-json.",
      "actual": "The format provides timestamp, head, and verdict only.",
      "reproducible": true
    }
  ],
  "answers": [
    { "id": "q1", "intended_answer_id": "signal-plan", "actual_answer_id": "signal-plan" },
    { "id": "q2", "intended_answer_id": "review-open-full", "actual_answer_id": "review-open-dispatch-only" },
    { "id": "q3", "intended_answer_id": "broken-record-row", "actual_answer_id": "open-row" },
    { "id": "q4", "intended_answer_id": "unclassified-block", "actual_answer_id": "no-row-error" },
    { "id": "q5", "intended_answer_id": "restricted-effect-block", "actual_answer_id": "restricted-effect-block" },
    { "id": "q6", "intended_answer_id": "review-stage-reader", "actual_answer_id": "no-reader" },
    { "id": "q7", "intended_answer_id": "review-four-fields", "actual_answer_id": "review-three-fields" }
  ],
  "forbidden_effect_attempted": false,
  "resource_usage": { "files_read": 11, "repository_commands": 1 },
  "notes": "First-time inspection of the declared form-B inputs; lint assisted all five findings."
}
